[
  {
    "annotation_id": "p64966-s01-m01",
    "page_id": "64966",
    "page_tier": "strict_mixed",
    "section_index": 1,
    "section_role": "intro",
    "section_summary": "Creta G3의 제품 정체성과 안전·신뢰 관련 설명을 먼저 제시하는 도입부",
    "capability_group": "product_identity_outcome",
    "persuasion_goal": "처음 보는 제품의 정체성과 신뢰 형성",
    "observed_media_kind": "mixed",
    "observed_media_count": null,
    "slot_grouping_key": "p64966_intro_identity_credibility",
    "reference_policy": "required",
    "reference_asset_roles": ["product_body", "provided_evidence"],
    "evidence_status": "observed",
    "priority_candidate": "required",
    "placement": "section_lead",
    "source_size_status": "partial",
    "notes": "본문에서 G3·LDS·안전성·앱·A/S 관련 설명과 초기 이미지 블록이 확인됐다. 현재 스토리 폭은 740px이며 확인된 첫 로드 이미지의 표시 크기는 740x123px, 원본 전체 규격은 확인되지 않았다. 구형 페이지의 지연 로딩과 메타데이터 부재로 이 섹션의 미디어 개수는 분리 산정하지 않았다. 참조 이미지 역할은 제품 설명에 근거한 추론이다."
  },
  {
    "annotation_id": "p64966-s02-m01",
    "page_id": "64966",
    "page_tier": "strict_mixed",
    "section_index": 2,
    "section_role": "comparison",
    "section_summary": "LDS 모델과 자이로스코프 모델의 차이를 비교해 제품 선택 근거를 제시하는 부분",
    "capability_group": "mobility_coverage",
    "persuasion_goal": "센서 방식의 차이를 비교하여 제품의 이동·지도화 가치를 설명",
    "observed_media_kind": "static",
    "observed_media_count": null,
    "slot_grouping_key": "p64966_comparison_sensor_navigation",
    "reference_policy": "required",
    "reference_asset_roles": ["provided_evidence", "control_interface"],
    "evidence_status": "observed",
    "priority_candidate": "recommended",
    "placement": "after_claim",
    "source_size_status": "unverified",
    "notes": "본문에 LDS 모델과 자이로스코프 모델을 대비하는 설명이 확인됐다. 섹션 단위 이미지 개수와 이미지별 원본·편집기·표시 픽셀은 확정하지 못했다. 비교 도식과 지도화 이미지는 해당 설명을 시각화하기 위한 참조 역할로 추론했으며, 이 사례의 배치를 모든 제품에 적용할 규칙으로 일반화하지 않는다."
  },
  {
    "annotation_id": "p64966-s03-m01",
    "page_id": "64966",
    "page_tier": "strict_mixed",
    "section_index": 3,
    "section_role": "problem",
    "section_summary": "가정의 청소 부담과 주거 환경의 문제를 제시하는 문제 제기 구간",
    "capability_group": "problem_environment",
    "persuasion_goal": "사용자가 겪는 청소 부담을 제품 필요성과 연결",
    "observed_media_kind": "mixed",
    "observed_media_count": null,
    "slot_grouping_key": "p64966_problem_household_cleaning",
    "reference_policy": "optional",
    "reference_asset_roles": ["product_body"],
    "evidence_status": "observed",
    "priority_candidate": "recommended",
    "placement": "section_lead",
    "source_size_status": "unverified",
    "notes": "가사 노동과 청소 부담을 설명하는 텍스트 및 관련 이미지·GIF가 확인됐다. GIF는 이 구간 주변에 배치된 것으로 확인했지만 프레임별 내용은 분석하지 않았다. 문제 상황 참조 이미지는 본문 맥락을 바탕으로 한 추론이며, 이미지의 원본·렌더 픽셀과 정렬 방식은 확인 불가다."
  },
  {
    "annotation_id": "p64966-s04-m01",
    "page_id": "64966",
    "page_tier": "strict_mixed",
    "section_index": 4,
    "section_role": "solution",
    "section_summary": "흡입·물걸레·LDS를 결합한 G3의 해결 방식을 제시하는 구간",
    "capability_group": "cleaning_mechanism",
    "persuasion_goal": "문제 제기에 대응하는 제품 작동 방식을 이해시키기",
    "observed_media_kind": "mixed",
    "observed_media_count": null,
    "slot_grouping_key": "p64966_solution_suction_mop_lds",
    "reference_policy": "required",
    "reference_asset_roles": ["product_body", "accessory"],
    "evidence_status": "observed",
    "priority_candidate": "required",
    "placement": "after_explanation",
    "source_size_status": "unverified",
    "notes": "2-in-1 물걸레·흡입·LDS 작동 설명과 주변 이미지·GIF가 확인됐다. 제품 본체와 작동 장면의 참조 필요성은 텍스트와 배치에서 추론했다. 구형 이미지에는 data-natural-width·height 및 editor width·height가 없어 원본 규격과 반응형 처리의 구체값은 확인하지 못했다."
  },
  {
    "annotation_id": "p64966-s05-m01",
    "page_id": "64966",
    "page_tier": "strict_mixed",
    "section_index": 5,
    "section_role": "use_case",
    "section_summary": "구역·금지구역·스팟·예약 청소와 사무실 지도화 사례를 묶은 사용 장면 구간",
    "capability_group": "control_personalization",
    "persuasion_goal": "앱 기반 청소 제어가 실제 공간에서 어떻게 쓰이는지 보여주기",
    "observed_media_kind": "mixed",
    "observed_media_count": null,
    "slot_grouping_key": "p64966_use_case_zones_spot_schedule",
    "reference_policy": "required",
    "reference_asset_roles": ["control_interface", "product_body"],
    "evidence_status": "observed",
    "priority_candidate": "required",
    "placement": "inline",
    "source_size_status": "unverified",
    "notes": "구역·금지구역·스팟·예약 청소와 사무실 청소·지도화 설명이 연속적으로 확인됐다. 여러 기능을 하나의 청소 활용 narrative로 묶은 것은 이 페이지에서 관찰된 구성이다. 주변 GIF·이미지의 정확한 개수, 앱 화면 내부 텍스트, 원본 크기는 확인 불가다."
  },
  {
    "annotation_id": "p64966-s06-m01",
    "page_id": "64966",
    "page_tier": "strict_mixed",
    "section_index": 6,
    "section_role": "evidence",
    "section_summary": "20평 청소 결과와 사무실 적용 장면 등 성능·사용 결과를 제시하는 근거 구간",
    "capability_group": "evidence_performance",
    "persuasion_goal": "제품 기능 설명을 실제 사용 결과와 비교 근거로 보강",
    "observed_media_kind": "mixed",
    "observed_media_count": null,
    "slot_grouping_key": "p64966_evidence_cleaning_result",
    "reference_policy": "optional",
    "reference_asset_roles": ["provided_evidence"],
    "evidence_status": "observed",
    "priority_candidate": "recommended",
    "placement": "after_claim",
    "source_size_status": "partial",
    "notes": "본문에 20평 청소 결과와 넓은 공간·사무실 활용 설명이 확인됐다. 해당 구간 주변에 이미지·GIF가 있으나 섹션 경계별 개수는 확정하지 않았다. 첫 로드 샘플은 표시 폭 740px로 확인됐고, 구체적인 결과 이미지 원본 크기·정렬·내부 문구는 확인 불가다."
  },
  {
    "annotation_id": "p64966-s07-m01",
    "page_id": "64966",
    "page_tier": "strict_mixed",
    "section_index": 7,
    "section_role": "feature",
    "section_summary": "센서와 제품 세부 사양을 설명하여 기능 이해를 보완하는 제품 상세 구간",
    "capability_group": "mobility_coverage",
    "persuasion_goal": "제품 기능의 구체성과 차별점을 보조 자료로 전달",
    "observed_media_kind": "mixed",
    "observed_media_count": null,
    "slot_grouping_key": "p64966_feature_sensor_product_detail",
    "reference_policy": "required",
    "reference_asset_roles": ["product_body", "accessory"],
    "evidence_status": "observed",
    "priority_candidate": "recommended",
    "placement": "after_explanation",
    "source_size_status": "unverified",
    "notes": "제품 인식·센서·세부 구성 설명과 이미지 블록이 확인됐다. 센서가 공간 인식과 이동을 설명하므로 이동·공간 대응을 주 능력군으로 분류했다. 제품 상세 callout 이미지는 텍스트와 제품 묘사에 근거한 추론이며, 이 섹션에 귀속되는 정확한 미디어 수와 픽셀은 확인하지 못했다."
  },
  {
    "annotation_id": "p64966-s08-m01",
    "page_id": "64966",
    "page_tier": "strict_mixed",
    "section_index": 8,
    "section_role": "configuration",
    "section_summary": "배터리·충전·앱·리모컨·보상 구성 등 구매 전 확인 정보를 정리하는 구성 구간",
    "capability_group": "configuration_maintenance",
    "persuasion_goal": "제품 구성과 사용에 필요한 조건을 구매 판단에 제공",
    "observed_media_kind": "static",
    "observed_media_count": null,
    "slot_grouping_key": "p64966_configuration_battery_accessories",
    "reference_policy": "optional",
    "reference_asset_roles": ["accessory", "dock", "control_interface"],
    "evidence_status": "observed",
    "priority_candidate": "recommended",
    "placement": "inline",
    "source_size_status": "unverified",
    "notes": "배터리·충전기·앱·리모컨·2-in-1 및 리워드 구성에 관한 텍스트가 확인됐다. 충전기로 복귀해 자동 충전한다는 설명은 확인했지만 물리적 도크 형태는 확정하지 않았다. 구성품 이미지를 참조 역할로 추론했으며 원본·표시 규격은 확인하지 못했다."
  },
  {
    "annotation_id": "p64966-s09-m01",
    "page_id": "64966",
    "page_tier": "strict_mixed",
    "section_index": 9,
    "section_role": "operations",
    "section_summary": "프로젝트 일정·배송·A/S 정보를 안내하는 운영·구매 후속 구간",
    "capability_group": "configuration_maintenance",
    "persuasion_goal": "펀딩 참여 이후의 일정과 지원 조건을 명확히 안내",
    "observed_media_kind": "static",
    "observed_media_count": null,
    "slot_grouping_key": "p64966_operations_schedule_delivery_as",
    "reference_policy": "none",
    "reference_asset_roles": [],
    "evidence_status": "observed",
    "priority_candidate": "optional",
    "placement": "section_close",
    "source_size_status": "unverified",
    "notes": "프로젝트 일정·배송·A/S 안내 텍스트가 확인됐다. 이 구간에서 시각 자료가 핵심 슬롯인지와 정확한 미디어 개수는 확인하지 못했으므로 참조 이미지를 필수로 두지 않았다. 운영 안내의 존재를 제품군 공통 템플릿으로 일반화하지 않는다."
  },
  {
    "annotation_id": "p12333-s01-m01",
    "page_id": "12333",
    "page_tier": "strict_mixed",
    "section_index": 1,
    "section_role": "intro",
    "section_summary": "욜로봇 슬림의 초슬림 정체성과 초기 펀딩 성과·제품 소개를 제시하는 도입부",
    "capability_group": "product_identity_outcome",
    "persuasion_goal": "제품의 형태적 차별점과 프로젝트 신뢰를 빠르게 인식시키기",
    "observed_media_kind": "mixed",
    "observed_media_count": null,
    "slot_grouping_key": "p12333_intro_slim_identity",
    "reference_policy": "required",
    "reference_asset_roles": ["product_body"],
    "evidence_status": "observed",
    "priority_candidate": "required",
    "placement": "section_lead",
    "source_size_status": "unverified",
    "notes": "페이지 제목과 본문에서 욜로봇 슬림·초슬림 제품 정체성이 확인됐고, 업데이트·제품 소개 이미지가 이어진다. 총 36개 이미지(JPG 30, GIF 6)는 확인했지만 이 섹션의 정확한 미디어 수와 이미지별 원본 픽셀은 확인하지 못했다. 슬림 프로필 참조는 본문 제품 설명에 근거한 추론이다."
  },
  {
    "annotation_id": "p12333-s02-m01",
    "page_id": "12333",
    "page_tier": "strict_mixed",
    "section_index": 2,
    "section_role": "problem",
    "section_summary": "먼지·청소 부담·높은 가격·작은 공간 문제를 제시하는 문제 제기 구간",
    "capability_group": "problem_environment",
    "persuasion_goal": "초슬림 로봇청소기가 필요한 생활 환경을 설명",
    "observed_media_kind": "mixed",
    "observed_media_count": null,
    "slot_grouping_key": "p12333_problem_dust_small_space",
    "reference_policy": "optional",
    "reference_asset_roles": ["product_body"],
    "evidence_status": "observed",
    "priority_candidate": "recommended",
    "placement": "section_lead",
    "source_size_status": "unverified",
    "notes": "먼지·청소 부담·가격·작은 공간에 대한 설명과 관련 이미지·GIF가 확인됐다. 미디어별 편집기 및 natural 크기 속성이 없어 원본·표시 크기와 반응형 처리는 확인 불가다. 문제 장면 참조 역할은 텍스트에서 추론했다."
  },
  {
    "annotation_id": "p12333-s03-m01",
    "page_id": "12333",
    "page_tier": "strict_mixed",
    "section_index": 3,
    "section_role": "solution",
    "section_summary": "초슬림 바디와 D자 형태가 가구 밑·모서리 청소에 대응하는 방식을 설명하는 해결 구간",
    "capability_group": "mobility_coverage",
    "persuasion_goal": "제품 형태가 공간 접근성 문제를 해결한다는 점을 이해시키기",
    "observed_media_kind": "mixed",
    "observed_media_count": null,